{
  "schema_version": "advanced-seed-release-evidence-v1.0.0",
  "release_id": "REPLACE_ME",
  "git_sha": "REPLACE_ME",
  "target_environment": "staging",
  "release_mode": "SCHEMA_ONLY",
  "ci": {
    "boundary": "FAIL",
    "python_compile": "FAIL",
    "frontend_validate": "FAIL"
  },
  "migrations": {
    "plan_version": "advanced-schema-sequence-v1.0.0",
    "dry_run": "FAIL",
    "applied": "NOT_RUN",
    "canonical_data_applied": false
  },
  "content": {
    "state": "ADVANCED_CANONICAL_CONTENT_EMPTY"
  },
  "release_note": "REPLACE_ME"
}
